{
  "week_id": "2026-W33",
  "year": 2026,
  "week": 33,
  "generated_at": "2026-08-16T11:13:24.370Z",
  "schemaVersion": 2,
  "weekId": "2026-W33",
  "anchor": "2026-08-16",
  "ranges": {
    "weekId": "2026-W33",
    "anchor": "2026-08-16",
    "delayDays": {
      "gsc": 3,
      "ga4": 1,
      "adsense": 1
    },
    "ga4": {
      "this": {
        "start": "2026-08-09",
        "end": "2026-08-15"
      },
      "prev": {
        "start": "2026-08-02",
        "end": "2026-08-08"
      },
      "finalized7d": {
        "periodStart": "2026-08-09",
        "periodEnd": "2026-08-15",
        "windowDays": 7
      },
      "previous7d": {
        "periodStart": "2026-08-02",
        "periodEnd": "2026-08-08",
        "windowDays": 7
      }
    },
    "gsc": {
      "this": {
        "start": "2026-08-07",
        "end": "2026-08-13"
      },
      "prev": {
        "start": "2026-07-31",
        "end": "2026-08-06"
      },
      "finalized7d": {
        "periodStart": "2026-08-07",
        "periodEnd": "2026-08-13",
        "windowDays": 7
      },
      "previous7d": {
        "periodStart": "2026-07-31",
        "periodEnd": "2026-08-06",
        "windowDays": 7
      }
    }
  },
  "finalized7d": {
    "gsc": {
      "periodStart": "2026-08-07",
      "periodEnd": "2026-08-13",
      "windowDays": 7,
      "isFinalized": true,
      "generatedAt": "2026-08-16T11:13:24.370Z",
      "source": "gsc",
      "limitations": [
        "取得遅延 3 日 (anchor=2026-08-16)"
      ],
      "kpis": {
        "clicks": 930,
        "impressions": 30995,
        "ctr": 0.03000483949024036,
        "position": 7.793999032101952
      },
      "coverage": {
        "status": "complete",
        "missingDates": [],
        "presentCount": 7,
        "expectedCount": 7
      },
      "status": "complete",
      "insufficientReason": null
    },
    "ga4": {
      "periodStart": "2026-08-09",
      "periodEnd": "2026-08-15",
      "windowDays": 7,
      "isFinalized": true,
      "generatedAt": "2026-08-16T11:13:24.370Z",
      "source": "ga4",
      "limitations": [
        "取得遅延 1 日 (anchor=2026-08-16)",
        "KPI は country=Japan clean slice。raw は pollution 監視専用"
      ],
      "kpis": {
        "activeUsers": 1925,
        "sessions": 2244,
        "engagedSessions": 1616
      },
      "pollution": {
        "rawSessions": 2630,
        "jpSessions": 2244,
        "pollutedSessions": 386,
        "pollutedPct": 14.7
      }
    }
  },
  "previous7d": {
    "gsc": {
      "periodStart": "2026-07-31",
      "periodEnd": "2026-08-06",
      "windowDays": 7,
      "isFinalized": true,
      "generatedAt": "2026-08-16T11:13:24.370Z",
      "source": "gsc",
      "limitations": [
        "取得遅延 3 日 (anchor=2026-08-16)"
      ],
      "kpis": {
        "clicks": 866,
        "impressions": 25293,
        "ctr": 0.03423872217609615,
        "position": 8.116514450638515
      },
      "coverage": {
        "status": "complete",
        "missingDates": [],
        "presentCount": 7,
        "expectedCount": 7
      },
      "status": "complete"
    },
    "ga4": {
      "periodStart": "2026-08-02",
      "periodEnd": "2026-08-08",
      "windowDays": 7,
      "isFinalized": true,
      "generatedAt": "2026-08-16T11:13:24.370Z",
      "source": "ga4",
      "limitations": [
        "取得遅延 1 日 (anchor=2026-08-16)",
        "KPI は country=Japan clean slice。raw は pollution 監視専用"
      ],
      "kpis": {
        "activeUsers": 2013,
        "sessions": 2385,
        "engagedSessions": 1714
      }
    }
  },
  "ga4": {
    "channels": [
      {
        "channel": "Organic Search",
        "thisUsers": 1714,
        "prevUsers": 1728,
        "userDelta": -14,
        "userDeltaPct": -0.8101851851851851,
        "thisSessions": 1976,
        "prevSessions": 2038,
        "thisEngagedSessions": 1437,
        "prevEngagedSessions": 1489,
        "thisEngagementRate": 0.7272267206477733
      },
      {
        "channel": "Direct",
        "thisUsers": 95,
        "prevUsers": 139,
        "userDelta": -44,
        "userDeltaPct": -31.654676258992804,
        "thisSessions": 124,
        "prevSessions": 169,
        "thisEngagedSessions": 79,
        "prevEngagedSessions": 105,
        "thisEngagementRate": 0.6370967741935484
      },
      {
        "channel": "Referral",
        "thisUsers": 86,
        "prevUsers": 93,
        "userDelta": -7,
        "userDeltaPct": -7.526881720430108,
        "thisSessions": 108,
        "prevSessions": 106,
        "thisEngagedSessions": 81,
        "prevEngagedSessions": 85,
        "thisEngagementRate": 0.75
      },
      {
        "channel": "AI Assistant",
        "thisUsers": 27,
        "prevUsers": 44,
        "userDelta": -17,
        "userDeltaPct": -38.63636363636363,
        "thisSessions": 32,
        "prevSessions": 56,
        "thisEngagedSessions": 17,
        "prevEngagedSessions": 29,
        "thisEngagementRate": 0.53125
      },
      {
        "channel": "Organic Social",
        "thisUsers": 3,
        "prevUsers": 4,
        "userDelta": -1,
        "userDeltaPct": -25,
        "thisSessions": 3,
        "prevSessions": 7,
        "thisEngagedSessions": 2,
        "prevEngagedSessions": 3,
        "thisEngagementRate": 0.6666666666666666
      },
      {
        "channel": "Unassigned",
        "thisUsers": 0,
        "prevUsers": 5,
        "userDelta": -5,
        "userDeltaPct": -100,
        "thisSessions": 1,
        "prevSessions": 9,
        "thisEngagedSessions": 0,
        "prevEngagedSessions": 3,
        "thisEngagementRate": 0
      }
    ],
    "total": {
      "thisUsers": 1925,
      "prevUsers": 2013,
      "thisSessions": 2244,
      "prevSessions": 2385,
      "thisEngagedSessions": 1616,
      "prevEngagedSessions": 1714,
      "userDelta": -88,
      "userDeltaPct": -4.371584699453552,
      "engagedSessionDelta": -98,
      "engagedSessionDeltaPct": -5.717619603267211
    },
    "organic": {
      "channel": "Organic Search",
      "thisUsers": 1714,
      "prevUsers": 1728,
      "userDelta": -14,
      "userDeltaPct": -0.8101851851851851,
      "thisSessions": 1976,
      "prevSessions": 2038,
      "thisEngagedSessions": 1437,
      "prevEngagedSessions": 1489,
      "thisEngagementRate": 0.7272267206477733
    },
    "pollution": {
      "rawSessions": 2630,
      "jpSessions": 2244,
      "pollutedSessions": 386,
      "pollutedPct": 14.7
    },
    "slice": "country=Japan (clean)"
  },
  "gsc": {
    "coverage": {
      "finalized7d": {
        "status": "complete",
        "missingDates": [],
        "presentCount": 7,
        "expectedCount": 7
      },
      "previous7d": {
        "status": "complete",
        "missingDates": [],
        "presentCount": 7,
        "expectedCount": 7
      }
    },
    "kpiComplete": true,
    "insufficientReason": null,
    "total": {
      "thisClicks": 930,
      "prevClicks": 866,
      "clickDelta": 64,
      "clickDeltaPct": 7.390300230946882,
      "thisImpressions": 30995,
      "prevImpressions": 25293,
      "impressionDelta": 5702,
      "thisCtr": 0.03000483949024036,
      "prevCtr": 0.03423872217609615,
      "thisPosition": 7.793999032101952,
      "prevPosition": 8.116514450638515
    },
    "topQueries": [
      {
        "query": "うどん消費量ランキング",
        "clicks": 17,
        "impressions": 93,
        "ctr": 0.1827956989247312,
        "position": 3.053763440860215
      },
      {
        "query": "うどん 消費量 ランキング",
        "clicks": 10,
        "impressions": 52,
        "ctr": 0.19230769230769232,
        "position": 3.1153846153846154
      },
      {
        "query": "子育てしやすい県ランキング",
        "clicks": 7,
        "impressions": 22,
        "ctr": 0.3181818181818182,
        "position": 2.5454545454545454
      },
      {
        "query": "納豆消費量 ランキング",
        "clicks": 7,
        "impressions": 137,
        "ctr": 0.051094890510948905,
        "position": 4.364963503649635
      },
      {
        "query": "納豆消費量 ランキング 最新",
        "clicks": 6,
        "impressions": 30,
        "ctr": 0.2,
        "position": 2.466666666666667
      },
      {
        "query": "stats47",
        "clicks": 5,
        "impressions": 6,
        "ctr": 0.8333333333333334,
        "position": 2.5
      },
      {
        "query": "都道府県別 平均身長",
        "clicks": 5,
        "impressions": 37,
        "ctr": 0.13513513513513514,
        "position": 7.1891891891891895
      },
      {
        "query": "うなぎ 消費量 ランキング",
        "clicks": 4,
        "impressions": 46,
        "ctr": 0.08695652173913043,
        "position": 4.195652173913043
      },
      {
        "query": "カツオ 漁獲量 ランキング",
        "clicks": 4,
        "impressions": 59,
        "ctr": 0.06779661016949153,
        "position": 5.711864406779661
      },
      {
        "query": "子育てしやすい都道府県ランキング",
        "clicks": 4,
        "impressions": 8,
        "ctr": 0.5,
        "position": 2
      }
    ]
  },
  "psi": {
    "skipped": true,
    "reason": "PSI_API_KEY 未設定"
  },
  "notes": [
    "週次期間契約: KPI/WoW は finalized7d (GSC 2026-08-07〜2026-08-13 / GA4 2026-08-09〜2026-08-15) と直前の重複しない previous7d のみ",
    "GA4 は country=Japan clean slice (raw は pollution 監視専用)",
    "NSM = 週間エンゲージドセッション数 (GA4 engagedSessions 全チャネル合計・Japan-only)",
    "NSM 定義: docs/00_プロジェクト管理/02_収益化戦略.md"
  ]
}
